username;date;retweets;favorites;text;geo;mentions;hashtags;id;permalink
;2020-02-13 12:41;0;0;"もし生き物以外に生まれていたら… あなたは「空」です 寛大な心 自分を押し殺しがち 穏やかで落ち着いている 聞き上手 # 生き物以外に生まれていたら診断 # ホイミーhttps://hoyme.jp/shindan/26643/results/18 …";;;# #;"1227905634395246592";https://twitter.com/crono_tiger/status/1227905634395246592
;2020-02-13 12:39;0;0;"なんか地味ーに揺れてる…？";;;;"1227905202298056704";https://twitter.com/crono_tiger/status/1227905202298056704
;2020-02-13 12:31;0;0;"佐助：1週間ほど前から変なことが起こっている。少し聞いてくれ。最初に言っておくが俺は妄想癖でも総合失調症でも病気でもなんでもない。笑わないでくれ。ガチだ。 最近猫の忍者に狙われてる。";;;;"1227903042705477632";https://twitter.com/Crono_SW_bot/status/1227903042705477632
;2020-02-13 12:23;0;0;"Te faltaba el pinganillo para escuchar las referencias de los puntos kilométricos de la crono...";;;;"1227901091544797184";https://twitter.com/ricardorosety/status/1227901091544797184
;2020-02-13 12:21;1;4;"| Tenemos nuevo crono más rápido en el Shakedown, por parte de @ KalleRovanpera, tras completar 4 pasadas al recorrido. Recordemos que algunos equipos no han completado sus terceras pasadas. # WRC # RallySwedenpic.twitter.com/8rIFglM7xU";;@;# #;"1227900557131755520";https://twitter.com/MundoRallys/status/1227900557131755520
;2020-02-13 12:18;2;5;"If you have Netflix I really recommend checking Dragon Quest Your Story. DreamWorks quality animation and didn't mess too much with the original story solid 8/10 from me.";;;;"1227899927872856064";https://twitter.com/Crono_Ssb/status/1227899927872856064
;2020-02-13 11:55;0;0;"もーすぐおうちー。 ほんと外いる方が調子いいのはやはり花粉ではなかった…？";;;;"1227893939039920129";https://twitter.com/crono_tiger/status/1227893939039920129
;2020-02-13 11:48;0;2;"And hopefully we never will";;;;"1227892351319920640";https://twitter.com/speedpunchx/status/1227892351319920640
;2020-02-13 11:39;0;0;"むっちむち～～！そしてオッドアイ！レアでかわいい(*´ω｀*)";;;;"1227890041738817536";https://twitter.com/Crono_1989/status/1227890041738817536
;2020-02-13 11:38;0;7;"Tras la segunda pasada al shakedown, Craig Breen y Paul Nagle son los que tienen ahora el mejor crono provisional. # RallySweden Lo hacen por delante de Ott Tänak(+1.6). Kalle Rovanpera, tercero, no mejora el crono de su primera pasada. # WRC";;;# #;"1227889738687877120";https://twitter.com/RubnPerez/status/1227889738687877120
;2020-02-13 11:32;0;0;"ですよねー！どこでもドアほしいです(˘ω˘)";;;;"1227888324146188289";https://twitter.com/raika_lemoni/status/1227888324146188289
;2020-02-13 11:31;0;0;"ハルカ「死ぬという事がどれほどの痛みを伴うものか分かるか？ 殺される側も、殺す側も───此処にこうして、遺された者達が、どれほどの痛みを背負うことになるかわかるか！ それは、例えやり直しが出来ようが何だろうが……絶対に！ 他人に与えてはならないものなんだよッ！ 竜宮レナ！！」";;;;"1227887946583265281";https://twitter.com/Crono_SW_bot/status/1227887946583265281
;2020-02-13 11:28;0;1;"Así están las cosas, por el momento, en el Shakedown de Suecia. Casi todos los equipos # WRC (menos Tänak y Suninen) han realizado dos pasadas al trazado, de echo, algunos ya realizaron una tercera pasada. Por ahora, Craig Breen obtiene el crono más rápido. # RallySwedenpic.twitter.com/Xt5tFxG2xW";;;# #;"1227887329714503680";https://twitter.com/MundoRallys/status/1227887329714503680
;2020-02-13 11:18;0;0;"OZ Racing Crono HT 7x16/4x108 D75 ET25 White http://specsan.com/wheels-and-rims-oz-racing/oz-racing-crono-ht-7x16-4x108-d75-et25-white … # OZ_Racing";;;#;"1227884624212373511";https://twitter.com/apatab/status/1227884624212373511
;2020-02-13 11:11;0;0;"とらさんもお疲れ様です！日曜寒くないといいですよね…！";;;;"1227882982385410053";https://twitter.com/aodo_enomel/status/1227882982385410053
;2020-02-13 11:10;0;0;"そしたらお絵描きしつつお仕事もバリバリこなすのに…(･ω･｀*)ﾈｰ 移動時間って、でかいですよね…(˘ω˘)";;;;"1227882688494751744";https://twitter.com/crono_tiger/status/1227882688494751744
;2020-02-13 11:08;0;0;"あう……事務さんもお家でお仕事できたらいいのにー！！";;;;"1227882191062847490";https://twitter.com/raika_lemoni/status/1227882191062847490
;2020-02-13 11:07;0;0;"おつべじさんです！暖かいですねー(*´ω｀*)日曜日もこんな感じだといいのですが(*・ω・*)wkwk";;;;"1227882057528832001";https://twitter.com/crono_tiger/status/1227882057528832001
;2020-02-13 11:05;0;0;"ガイスト「──三人死んで、一人は失明。あれじゃあもう、とても今までのようには闘えナイ（T^T）」 シュトルツ 「別に。心の弱さが招いた結果だ。それは当人たちの問題だよ。尤も…… それを狙って暗躍した君の働きは無視できないけどね。クラウドナインへの敵対行動と見なし、君を粛清する」";;;;"1227881396527517696";https://twitter.com/Crono_SW_bot/status/1227881396527517696
;2020-02-13 11:02;0;0;"でも明日おきゅうりょうび！！！！";;;;"1227880706040188929";https://twitter.com/crono_tiger/status/1227880706040188929
;2020-02-13 11:02;0;0;"よきかなですねー(*´ω｀*) 働き方改革！ﾌﾝｽ( ´ ꒳ ` )=3 とらのすけ事務なのでそれがなかなか出来ないのが残念ですね…明日もお仕事…(´・ω・｀)";;;;"1227880660762710026";https://twitter.com/crono_tiger/status/1227880660762710026
;2020-02-13 11:01;0;0;"Game Theory: Who triggered Crono?";;;;"1227880531871711233";https://twitter.com/Spinny_ebooks/status/1227880531871711233
;2020-02-13 11:00;0;0;"あれpic.twitter.com/0F5MMWxhBp";;;;"1227880326023696384";https://twitter.com/crono_tiger/status/1227880326023696384
;2020-02-13 10:59;0;0;"今流行りのなんたらとかいう働き方ですね！よきかな〜！←";;;;"1227879915631939584";https://twitter.com/raika_lemoni/status/1227879915631939584
;2020-02-13 10:57;0;0;"なんと…!?Σ( ˙꒳ ˙ )!? もう会社行けないですー明日からおうちで仕事しますね！(iPadスチャッ)";;;;"1227879330925006849";https://twitter.com/crono_tiger/status/1227879330925006849
;2020-02-13 10:55;0;0;"花粉ではなくハウスダストだったのでは？！";;;;"1227879008370446336";https://twitter.com/raika_lemoni/status/1227879008370446336
;2020-02-13 10:54;0;0;"駅暑い";;;;"1227878715264139264";https://twitter.com/crono_tiger/status/1227878715264139264
;2020-02-13 10:49;0;0;"crono was a scam by na to get lpl to stop plaaying so we could look better international scam train scam train scam train";;;;"1227877538313261067";https://twitter.com/KawaiiCakes_/status/1227877538313261067
;2020-02-13 10:49;0;1;"おつありがたいがーですー(｢・ω・)｢ｶﾞｵｰ (/◎＼)ｽﾞｽﾞｽﾞ…ε=(´∀｀*)ﾌﾟﾊｰ";;;;"1227877337653399554";https://twitter.com/crono_tiger/status/1227877337653399554
;2020-02-13 10:48;0;0;"おつありがたいがーです！(｢・ω・)｢ｶﾞｵｰ なんか外出たら鼻が通りました快適(º∀º)";;;;"1227877210662436864";https://twitter.com/crono_tiger/status/1227877210662436864
;2020-02-13 10:47;0;0;"マッキー…お前…";;;;"1227877060741230598";https://twitter.com/crono_tiger/status/1227877060741230598
;2020-02-13 10:47;0;0;"お疲れ様です〜!!!(っ´∀`)っ";;;;"1227877034006695936";https://twitter.com/mYwTXg2gweaC6LT/status/1227877034006695936
;2020-02-13 10:46;0;0;"お疲れさまです！＼＼\\٩( 'ω' )و //／／";;;;"1227876697556471808";https://twitter.com/raika_lemoni/status/1227876697556471808
;2020-02-13 10:45;0;1;"暖かいと言うより暑苦しいですな！ありがとうございます！⸜( ´ ꒳ ` )⸝♡︎";;;;"1227876517939597312";https://twitter.com/raika_lemoni/status/1227876517939597312
;2020-02-13 10:45;1;1;"きのしたさんは殺伐とした男女カプが好きなのだろうか…(˘ω˘) アトアルとかシルレスとかディミエデとか";;;;"1227876393226104832";https://twitter.com/crono_tiger/status/1227876393226104832
;2020-02-13 10:42;0;0;"というわけでしごおわだよー！！ 寄り道しようと思ったんだけど、もしかしてミクさん届くの受け取らないといけない…？と思い寄り道は明日にしようと思います。";;;;"1227875759554842625";https://twitter.com/crono_tiger/status/1227875759554842625
;2020-02-13 10:41;0;1;"雷花さぁぁぁん…ヽ(；▽；)ノ むしろ雷花さんがあたたかい…( ᵕ̩̩ㅅᵕ̩̩ )";;;;"1227875525202333698";https://twitter.com/crono_tiger/status/1227875525202333698
;2020-02-13 10:35;0;15;"pic.twitter.com/YOWnokhevs";;;;"1227873940749639680";https://twitter.com/AlejaDiaz98/status/1227873940749639680
;2020-02-13 10:35;0;0;"@ CocoSSB fucking dork lol.pic.twitter.com/2mY5scgXpM";;@;;"1227873909485207553";https://twitter.com/Crono_Ssb/status/1227873909485207553
;2020-02-13 10:34;0;0;"定時間際に無茶ぶりしてくんじゃねーーーーーーーーーーーーーーーーーーー";;;;"1227873643973136384";https://twitter.com/crono_tiger/status/1227873643973136384
;2020-02-13 10:34;5;13;"Tras la primera pasada al shakedown, Ott Tänak y Martin Jarveoja tienen de momento el mejor crono. # RallySweden Lo hacen por delante de Kalle Rovanpera(+2.5) y de Craig Breen(+2.6). # WRC Jari Matti Latvala, cuarto.";;;# #;"1227873578999275524";https://twitter.com/RubnPerez/status/1227873578999275524
;2020-02-13 10:31;0;0;"シュトルツ「──漸く戻ってこれた」 ハルカ「──大分掛かったみたいですね、兄さん」";;;;"1227872848011677697";https://twitter.com/Crono_SW_bot/status/1227872848011677697
;2020-02-13 10:28;0;0;"¡Os seguimos contando las últimas novedades de la # GBR2020 patrocinado por Kinesia! GBR completa (desde 65€)con: Sábado (10:00): etapa XC de 38 km Sábado (15:00): crono urbana de 7 km Domingo (9:00): Maratón XCM de 65 km Domingo (9:00) (desde 29€): Maratón XCM de 65 km pic.twitter.com/lOQRvdYEMc";;;#;"1227872033431683074";https://twitter.com/Sportkinesia/status/1227872033431683074
;2020-02-13 10:25;0;2;"My favorite was "Zoah is Crono".";;;;"1227871404256907266";https://twitter.com/4thdusterslip/status/1227871404256907266
;2020-02-13 10:25;0;1;"Jajajaja. A mí también me extrañaba, hasta que me di cuenta que tus rivales eran el crono y las leches que te metieras. Jajajajaja. En el modo "original", hay un mecánico que es CLAVADO a un antiguo vecino de mi finca, jajajajajajaja. Siempre me gustará el juego sólo por eso.";;;;"1227871302381428736";https://twitter.com/DSVizard/status/1227871302381428736
;2020-02-13 10:24;0;6;"i remember reading old crack theories about how like half the cast was chrono trigger characters in disguise and like, yeah, im not 100% sure miguel is crono or stuff like that but hey, theories!";;;;"1227871163445108736";https://twitter.com/ondoruragitan/status/1227871163445108736
;2020-02-13 10:23;0;0;"I can't wait for her to try to scam Crono and party :D";;;;"1227870866437857280";https://twitter.com/grigori_fox/status/1227870866437857280
;2020-02-13 10:22;0;0;"ゲーム作る人が近くにいるので思うのですが、みんな「楽しく遊んでもらいたい」「記憶に残る作品にしたい」と思って頑張ってるから、自分なりに楽しい遊び方をしてね。と思うとらのすけでした。";;;;"1227870611348738048";https://twitter.com/crono_tiger/status/1227870611348738048
;2020-02-13 10:22;0;0;"Smash ladder has a good tutorial to setup with dolphin";;;;"1227870582584164352";https://twitter.com/Crono_Ssb/status/1227870582584164352
;2020-02-13 10:20;0;1;"対人ゲームって、向いてる人と向いてない人がいると思うので、人それぞれ楽しく出来たらいいなと思いました。私は一人でコツコツやるのが好きなタイプなので、ゲーム中にオンライン要素が出てきたら切って進めることが多い。よ。それも一つのゲームの楽しみ方だよね。ね。";;;;"1227870213808328705";https://twitter.com/crono_tiger/status/1227870213808328705
;2020-02-13 10:19;0;1;"Jhoto theme better be high";;;;"1227869989237030912";https://twitter.com/Crono_Ssb/status/1227869989237030912
;2020-02-13 10:19;0;2;"Watching the dragon quest movie let's see how it goes";;;;"1227869882739576832";https://twitter.com/Crono_Ssb/status/1227869882739576832
;2020-02-13 10:05;0;0;"ハルカ「そうだな。それなら、もう一つ質問しようか」 レナ「うん？」 ハルカ「──圭一が何処に行ったか、知っているか？」 レナ「───いまのハルカちゃんみたいに、勘のいいお友達は、嫌いかな。かな」";;;;"1227866300489191424";https://twitter.com/Crono_SW_bot/status/1227866300489191424
;2020-02-13 10:00;1;9;"Ssssshhhhh, silencio, se rueda. Ya solo quedan 7 meses para @ CronoAsperillas . La única carrera contra el crono. Casas del Castañar paraíso natural. 13sept20 Nos vemos pic.twitter.com/vGteN85H3y";;@;;"1227865052251860992";https://twitter.com/CronoAsperillas/status/1227865052251860992
;2020-02-13 09:52;0;1;"おぉぉ…常葉さんも花粉にやられていますか…(´;ω;｀)お互い辛いですねぇ… 16日は完璧な状態で行きますので！鼻声かもしれませんが！よろしくお願いします!!('◇')ゞ";;;;"1227863216899801088";https://twitter.com/crono_tiger/status/1227863216899801088
;2020-02-13 09:50;0;0;"A veces de el Aldeano, ¿Eres feliz? Y Libertad de Lancer Lirical, Too Young de Khan Doble L, Lxve de Ante120, Dime que No de Crono$, Save that Shit de Lil Peep, Ficción de Costa, Lucy de Rels B, On My mind de Khan Doble L, Sin Perdón de Piezas y Fulana de Piezas";;;;"1227862712392339457";https://twitter.com/MartinRouterK13/status/1227862712392339457
;2020-02-13 09:48;0;0;"ええええ、だだ大丈夫ですか;;;花粉つらいですよね……同じく花粉症で鼻水と目が赤いかもなので、お気になさらずですよ花粉でお辛いのに申し訳ないけど、お会いしたいです";;;;"1227862201320345601";https://twitter.com/carrydon/status/1227862201320345601
;2020-02-13 09:46;0;1;"Muy buenos días. Venga caña";;;;"1227861492105650176";https://twitter.com/Mikel90753741/status/1227861492105650176
;2020-02-13 09:43;0;5;"Buenos días Mentes Perversas, Jueves ya, y mañana San Calentin..... De lo único que me doy cuenta cada día, es que la vida pasa muy deprisa, demasiado deprisa, y que los días que pasan ya no volverán, así que caña a la vida... a disfrutarla Sed malos, es más divertido";;;;"1227860862431571968";https://twitter.com/crono_sir/status/1227860862431571968
;2020-02-13 09:42;0;1;"英一さん生きて…(´;ω;｀)";;;;"1227860619191345152";https://twitter.com/crono_tiger/status/1227860619191345152
;2020-02-13 09:37;0;0;"今日は描くもの決まってるんだ…アンソロが先だけどね…アイコンどうしようかな…";;;;"1227859342612844544";https://twitter.com/crono_tiger/status/1227859342612844544
;2020-02-13 09:31;0;0;"ハルカ 「"死んだ人間は生き返らない"んだよ。だから死なないよう、人間は足掻くんだ。それを、出来るからという理由で簡単に生き返らせることが出来るようになっては」 「……生命の価値が、軽く成り過ぎる」";;;;"1227857747401510913";https://twitter.com/Crono_SW_bot/status/1227857747401510913
;2020-02-13 09:23;0;2;"メッセヨキーホルダー お腹の辺りを押すと「メッセヨ！」「トゥリャ！」「コレモサダメ！」「メッセヨ…(静かな方)」からランダムで喋ってくれる。 身の回りの嫌なこともメッセヨしてくれる";;;;"1227855703248793600";https://twitter.com/crono_tiger/status/1227855703248793600
;2020-02-13 09:15;0;0;"春はあげぽよ";;;;"1227853878890119168";https://twitter.com/crono_tiger/status/1227853878890119168
;2020-02-13 09:10;0;1;"Grande Crono Fox gracias a ti me hice una cuadra/sublime con jhin jajaja";;;;"1227852477430747136";https://twitter.com/marcosadrian20/status/1227852477430747136
;2020-02-13 09:09;0;2;"Omnubilado estaría todo el día observandotepic.twitter.com/4yMJg7EhbL";;;;"1227852257842036736";https://twitter.com/crono_sir/status/1227852257842036736
;2020-02-13 09:07;0;0;"ぽけっとてしゅーも買っておこう…箱で持って歩きたい…";;;;"1227851796485246976";https://twitter.com/crono_tiger/status/1227851796485246976
;2020-02-13 09:07;0;0;"日曜日はアレグラとスプレーとマスクと鼻炎薬持っていきます。それでもダメなこともあるので、常葉さん、べじさん、とらのすけがへにょへにょだったらごめんなさい。でも行く。";;;;"1227851719263973376";https://twitter.com/crono_tiger/status/1227851719263973376
;2020-02-13 09:05;0;0;"この状況からしばらくそのままにしておくと、末端から冷え始めます。だいぶ体力持っていかれてるな。帰りにモンエナキメるぜ";;;;"1227851323334258688";https://twitter.com/crono_tiger/status/1227851323334258688
;2020-02-13 09:05;0;0;"アナザーダブル「……よく見てんじゃねえか。探偵か何かでもやってんのか？」 ユリウス「いいや。俺はただの、護衛役さ──！」 アナザーダブル「ならとっとと護衛対象のとこに帰りやがれ────ッ！！」";;;;"1227851200919261184";https://twitter.com/Crono_SW_bot/status/1227851200919261184
;2020-02-13 09:04;0;0;"ﾅﾆｿﾚｶﾜﾖ";;;;"1227850960971550720";https://twitter.com/crono_tiger/status/1227850960971550720
;2020-02-13 09:04;0;0;"メッセヨの鳴き声は「メッ！」";;;;"1227850899143323648";https://twitter.com/crono_tiger/status/1227850899143323648
;2020-02-13 09:03;0;0;"妖怪メッセヨが花粉相手に頑張っている姿を想像して愛しい気持ちでいっぱいになっている夕方";;;;"1227850697292386304";https://twitter.com/crono_tiger/status/1227850697292386304
;2020-02-13 08:59;0;1;"あんな小さいもの相手に努力してくれる妖怪メッセヨすごい健気じゃない…？https://twitter.com/aodo_enomel/status/1227849418281377793/ …";;;;"1227849690390990848";https://twitter.com/crono_tiger/status/1227849690390990848
;2020-02-13 08:58;0;0;"なんか薬漬けみたいですねとらのすけ！！そんなに飲んでないよ！！月イチのあれと花粉の時期だけ多用するけどね！";;;;"1227849532420939776";https://twitter.com/crono_tiger/status/1227849532420939776
;2020-02-13 08:57;0;0;"お出かけ用お薬セットの中がだいぶ少なくなってきてるから補充せんと";;;;"1227849358797754369";https://twitter.com/crono_tiger/status/1227849358797754369
;2020-02-13 08:57;1;8;"Coche del día: SEAT Ronda Crono https://ift.tt/2ST6aDN pic.twitter.com/MdSTmx9RFO";;;;"1227849255953498114";https://twitter.com/javiercostas/status/1227849255953498114
;2020-02-13 08:57;0;1;"メッセヨのゲシュタルト崩壊";;;;"1227849193089187840";https://twitter.com/crono_tiger/status/1227849193089187840
;2020-02-13 08:57;0;1;"妖怪メッセヨは花粉もメッセヨしてくれますか…(なんでも妖怪メッセヨにメッセヨしてもらおうとするんじゃない";;;;"1227849145727062016";https://twitter.com/crono_tiger/status/1227849145727062016
;2020-02-13 08:55;0;1;"くすりのんだ";;;;"1227848776213094400";https://twitter.com/crono_tiger/status/1227848776213094400
;2020-02-13 08:55;0;1;"花粉とか動物の毛とかでアレルギー起こして鼻水が止まらなくなったときに、身体がぽかぽかして頭がぼーっとし始めて汗をかいてくる状態があるんですよ。それだいぶヤバいところまで来てるサインなんですよ。 いまそれ。";;;;"1227848731355074561";https://twitter.com/crono_tiger/status/1227848731355074561
;2020-02-13 08:51;0;1;"ニャン魚さんお疲れ様でした！ お絵描きも捗る花粉の季節ですがいかがお過ごしでしょうか。とらのすけは全花粉を滅せよしたい気持ちでいっぱいです。";;;;"1227847683294937090";https://twitter.com/crono_tiger/status/1227847683294937090
;2020-02-13 08:42;1;0;"5 games to get to know me: Crono Trigger Civilization II Civilization III Civilization IV Civilization VI https://twitter.com/dare_darou/status/1227844088558313472 …";;;;"1227845552173277184";https://twitter.com/prdn23/status/1227845552173277184
;2020-02-13 08:37;0;0;"でも過去問解いてるだけだと今回のやつ厳しいかもね 僕は過去問教えたり小テスト教える側だったから考えられたけど、問題大分変わってた感";;;;"1227844106577203206";https://twitter.com/Crono_kit/status/1227844106577203206
;2020-02-13 08:35;0;0;"ほらな、水のphは下がるんだよ";;;;"1227843745481207813";https://twitter.com/Crono_kit/status/1227843745481207813
;2020-02-13 08:33;0;0;"化学対あり 多分僕の勝ち";;;;"1227843193250746369";https://twitter.com/Crono_kit/status/1227843193250746369
;2020-02-13 08:32;0;0;"So it seem's that @ birdsofpreywb flim blames crono virus, boy's and now @ SonicMovie film for there shit birds of prey film you just can't not laugh at this crap get woke @ birdsofpreywb.";;@ @ @;;"1227842865113509888";https://twitter.com/Jozz2015/status/1227842865113509888
;2020-02-13 08:31;0;0;"ウィン「オッケー誰が空元気だふざけんなバーーーカ！」 パンチ！ グリフォン「ああああああああああああ！！！！？」 ウィン「お～さっぱりした！ なんかあんたとはいい喧嘩友達やれる気がする！」 フレデリカ「早速仲良さそうで何因りだ」";;;;"1227842643922567168";https://twitter.com/Crono_SW_bot/status/1227842643922567168
;2020-02-13 08:27;0;0;"¿Crees en el amor a primera vista? — Si, existe https://lap78.ask.fm/igoto/45DKECPW7B667HQMHN2IG6NM2OGDZKZFUHQOXBV7KHV2XYNMYIYNC6KOFFFM2QBQKKZP2FQJI5RH6FIN5U36Y3N7NLRP5BJDRYDB3ACPA5OTSMP6GWOCQ27RTGTO7XSURD22AFQX37TFDBUKIOME2WLX7XZHX4EQ2HMVH2DK2C33QUOYLNOSDA6EYJC372WGTESKIESNXZ4IFVA= …";;;;"1227841694017691648";https://twitter.com/Leaf_Crono/status/1227841694017691648
;2020-02-13 08:10;0;1;"# espirituRACER Coche del día: SEAT Ronda Crono https://espirituracer.com/cochedeldia/coche-del-dia-seat-ronda-crono/ … # Cochedeldía # Compacto # Gasolina # Seat # SEATRonda";;;# # # # # #;"1227837414011539457";https://twitter.com/espiritu_RACER/status/1227837414011539457
;2020-02-13 08:05;0;0;"ウィン 「なんで戻ってきたか、だって！？ 単純なことだよ！ ……誰だろうと、独りの寂しさに勝つことはできやしない！ 英雄だろうと、勇者だろうと、正義の味方であろうと、ヒーローであろうと──神であろうとだ！！」";;;;"1227836099302572033";https://twitter.com/Crono_SW_bot/status/1227836099302572033
;2020-02-13 07:54;0;3;"Recuerdo cuando Crono y mi ex se caían mal, después los presente y hasta el sol de hoy son súper panas";;;;"1227833437643395072";https://twitter.com/NiiaKros/status/1227833437643395072
;2020-02-13 07:46;0;1;"日曜日お出かけなんですよぅ。今の私にはコロナよりも花粉が怖い";;;;"1227831469936017408";https://twitter.com/crono_tiger/status/1227831469936017408
;2020-02-13 07:46;0;1;"TLも花粉の影響が…ほんと辛い季節になりましたなぁ…(´;ω;｀)";;;;"1227831380228263936";https://twitter.com/crono_tiger/status/1227831380228263936
;2020-02-13 07:44;0;0;"午後になって室内にいても花粉の影響が強くなってきた…夜だいじょうぶかな昨日もつらかったんだよなぁ";;;;"1227830834998046720";https://twitter.com/crono_tiger/status/1227830834998046720
;2020-02-13 07:39;0;1;"ばれんたいん絵…何かは描くつもりではあるけど構図の神次第かな('ω')";;;;"1227829620952588291";https://twitter.com/crono_tiger/status/1227829620952588291
;2020-02-13 07:31;0;0;"ユリウス「大会に優勝し、雛見沢で、彼はその少女……環いろは様に、想いを告げたそうで。 それからは、お二人は新しく恋仲として歩み始めていました」（ついでにそっちの二人もな……） ルゥシェ「…素敵なこと。そういいたいけれど…」 佐助「その眼をやめろ」「フッ飛ばすぞ」 キレッキレ";;;;"1227827550098903045";https://twitter.com/Crono_SW_bot/status/1227827550098903045
;2020-02-13 07:29;0;0;"https://youtu.be/NHJ6ARVQbNA Musica China here";;;;"1227827201313251328";https://twitter.com/TheLucaDeluxe/status/1227827201313251328
;2020-02-13 07:15;0;0;"Oh lordy, I don’t think his Master Sword is gonna last much longer before it breaks and this happens.pic.twitter.com/YtKr7YHg7g";;;;"1227823513379143680";https://twitter.com/yung_crono/status/1227823513379143680
;2020-02-13 07:13;0;1;"# Tetris99 # Tetris # NintendoSwitch 初めて一桁乗れた！pic.twitter.com/2FsbHETHwH";;;# # #;"1227823063149895681";https://twitter.com/Crono_kit/status/1227823063149895681
;2020-02-13 07:08;0;0;"Y E S";;;;"1227821808851787776";https://twitter.com/jophsertanaka/status/1227821808851787776
;2020-02-13 07:07;0;0;"Ta okpic.twitter.com/rG25B9ZqmP";;;;"1227821609865621504";https://twitter.com/Crono_mn/status/1227821609865621504
