username;date;retweets;favorites;text;geo;mentions;hashtags;id;permalink
;2020-02-13 00:05;0;0;"デメテル「でも、セレスは泣いた！ 今日も、悲しいことを思い出して、怖くなったでしょ…！？」 セレス「そう！ 怖いし、泣く事だってあるよ！ でも……その怖さを超えて踏み出すのが、『勇気』なんだ！」 デメテル「ゆう、き……？」 セレス「勇気は、夢を叶える魔法だよ」";;;;"1227715308787523584";https://twitter.com/Crono_SW_bot/status/1227715308787523584
;2020-02-12 23:54;0;0;"奴の言ってる本質を理解してるってのは式を使いこなせる人じゃ無いぞ多分 式なんてパソコンにやらせれば良いしな";;;;"1227712619324334081";https://twitter.com/Crono_kit/status/1227712619324334081
;2020-02-12 23:50;0;3;"Esos bocatas, esas coca colas a las 5 de la mañana y esas charlas arreglando un servicio o queriéndolo poner a nuestra mano... Y sobre todo esos ratos de malignos o de crono terapia.";;;;"1227711681628954624";https://twitter.com/gregoriobecerra/status/1227711681628954624
;2020-02-12 23:44;0;0;"Nicepic.twitter.com/CTef7NT9pV";;;;"1227710058739511296";https://twitter.com/Crono_mn/status/1227710058739511296
;2020-02-12 23:39;0;22;"Duro como infancia en Siria el crono";;;;"1227708957399101445";https://twitter.com/VascoAizcorbe/status/1227708957399101445
;2020-02-12 23:39;0;0;"Crono has a long incubation period. Very dangerous. Wake up. https://twitter.com/TeamCavuto/status/1226872581283885056 …";;;;"1227708834631868419";https://twitter.com/BraibmonPerry/status/1227708834631868419
;2020-02-12 23:37;0;0;"Rápida sentencia de la vuelta a Colombia con la crono por equipos. No sé si Bernal o Carapaz están para quitar 45 segundos en un día de montaña a Higuita # TourColombia2020";;;#;"1227708264105861127";https://twitter.com/OperacionPuerto/status/1227708264105861127
;2020-02-12 23:33;0;0;"If you have the crono virus pls come to my school, affect me, then I’ll die";;;;"1227707383402651655";https://twitter.com/silver_stxrr/status/1227707383402651655
;2020-02-12 23:31;0;0;"ななしのひよこ：まあ……とりあえず彼氏さんが食らいつくさまを見ていようではありませんか(正座) ユリウス：そうですね……（昇天しながら ウィン：ユリウスならギリギリ当たりそうな命中してるのにね 救済神：よーし彼女反撃しちゃうからね！ 救済神：もうめっちゃ頑張っちゃうからね！";;;;"1227706795990245376";https://twitter.com/Crono_SW_bot/status/1227706795990245376
;2020-02-12 23:28;0;1;"Ya la conocía, temazopic.twitter.com/8FQFRctRjj";;;;"1227706003619295233";https://twitter.com/mega_avocado/status/1227706003619295233
;2020-02-12 23:19;0;1;"N0las enti3nd0";;;;"1227703854818635776";https://twitter.com/boLOURda/status/1227703854818635776
;2020-02-12 23:18;0;0;"Crono About lucca";;;;"1227703471106875394";https://twitter.com/GNLK34/status/1227703471106875394
;2020-02-12 23:16;0;0;"Nosotros lo hacíamos en balonmano, y los contrarios igual, por muy empatado que fuese el encuentro o poco tiempo que quedase (ten en cuenta que en balonmano no hay añadidos y el crono sigue hasta que lo para el árbitro)";;;;"1227703169679085568";https://twitter.com/mbode95/status/1227703169679085568
;2020-02-12 23:16;0;4;"Sofi La del Perrito Berretta me parece cruel y gracioso. Alto nombre.";;;;"1227703071712653313";https://twitter.com/soymarta_rada/status/1227703071712653313
;2020-02-12 23:13;0;0;"Bron James Finals 2016 y Miguel Indurain Crono de Luxemburgo https://twitter.com/palaciosmatias/status/1227302419266244608 …";;;;"1227702315802648577";https://twitter.com/MiniPontzi/status/1227702315802648577
;2020-02-12 23:10;0;0;"https://youtu.be/o_TIdWRuixo";;;;"1227701548811243520";https://twitter.com/Crono_mn/status/1227701548811243520
;2020-02-12 23:08;1;0;"# SARR2020 # Autos Etapa 5 - Cat. T2: Hernán Roberti fue el mejor en su Clase, con un crono de 3h27m14". Ramón Núñez 2° (+29m22"), Rodolfo Bollero 3° (+34m34"), Oscar Cruz 4° y Dino Bernabo 5°. Aún no figuran en los tiempos, Roberto Naivirt, Maximiliano Iglesias y Ricardo Zurman.";;;# #;"1227700943426347011";https://twitter.com/RRDakar2020/status/1227700943426347011
;2020-02-12 22:59;0;1;"Gatilho do crono mais conhecido como Chrono Trigger";;;;"1227698874397208581";https://twitter.com/makomakochopper/status/1227698874397208581
;2020-02-12 22:58;1;0;"# SARR2020 # Autos Juan Cruz Yacopini se quedó con la Etapa 5 en la Clase T1, con un crono de 2h31m23". Francisco Castro se ubicó 2° (+18m05"), Marcelo Rolando 3° (+43m37") y Hugo Goya 4°. Aún no figuran los tiempos de Marcelo Gastaldi, de Fernando León ni de Lino Sisterna.";;;# #;"1227698467792879616";https://twitter.com/RRDakar2020/status/1227698467792879616
;2020-02-12 22:52;0;1;"no te olvides de Daniel Felipe Martínez o el mismo Ivan Ramiro Sosa que es un formidable escalador, pero en el Ineos les están puliendo su crono... va a mejorar mucho...";;;;"1227696909021859840";https://twitter.com/DeportesYMasCol/status/1227696909021859840
;2020-02-12 22:49;0;3;"META • Recordeu, a les distancies 10, 21 i 42k passeu dos vegades per meta, la primera per saludar a la vostra afició al quilòmetre 6,5 i l'última vegada per parar el crono ! • Asfalt: 5, 10, 21 i… https://www.instagram.com/p/B8exctRIw1O/?igshid=jw06zneq3kdb …";;;;"1227696202336079873";https://twitter.com/runtossademar/status/1227696202336079873
;2020-02-12 22:47;1;2;"Totalmente de acuerdo contigo compañera, olvidarse del crono y disfrutar del ambiente";;;;"1227695704996532225";https://twitter.com/JaviHds42k/status/1227695704996532225
;2020-02-12 22:44;0;0;"Bring it on! I like me a good challenge!";;;;"1227694911543300097";https://twitter.com/yung_crono/status/1227694911543300097
;2020-02-12 22:43;0;1;"pic.twitter.com/1VZAXEzwUz";;;;"1227694715962888192";https://twitter.com/yung_crono/status/1227694715962888192
;2020-02-12 22:35;0;1;"No sé, eran varios a perseguir, algo más creo que pudo hacer. También es verdad que sí la última crono del Tour tuviera 60kms, Sky se la hubiera liado antes. Y siendo justos, el primer corredor que sacrificó Giro por Tour fue Indurain en 1995. Luego Riis, Ullrich y Armstrong ya..";;;;"1227692826529615872";https://twitter.com/mf_rober/status/1227692826529615872
;2020-02-12 22:34;0;0;"Pensando em como vou levar a crono pra volta do futuro";;;;"1227692560245764096";https://twitter.com/OGonzeli02/status/1227692560245764096
;2020-02-12 22:31;0;0;"ハルカ「死ぬという事がどれほどの痛みを伴うものか分かるか？ 殺される側も、殺す側も───此処にこうして、遺された者達が、どれほどの痛みを背負うことになるかわかるか！ それは、例えやり直しが出来ようが何だろうが……絶対に！ 他人に与えてはならないものなんだよッ！ 竜宮レナ！！」";;;;"1227691651822317568";https://twitter.com/Crono_SW_bot/status/1227691651822317568
;2020-02-12 22:25;0;0;"Buen balance del Crono en el Provincial de Cross https://infosocuellamos.com/buen-balance-del-crono-en-el-provincial-de-cross/ … vía @ infosocuellamos";;@;;"1227690217634717701";https://twitter.com/infoSocuellamos/status/1227690217634717701
;2020-02-12 22:21;0;0;"Entiendo que menos en la salida en masa, las demás especialidades son cronometradas, es decir, se gana por el crono, no por llegar el primero a la línea de llegada?";;;;"1227689293964922881";https://twitter.com/cronoramia/status/1227689293964922881
;2020-02-12 22:14;4;32;"Mejor tiempo para @ AlexPalou Pista seca para todos y ahí está marcando el ritmo en el crono 20 giros de momento. pic.twitter.com/GOzcPn8nSK";;@;;"1227687535650000897";https://twitter.com/mportilloES/status/1227687535650000897
;2020-02-12 22:14;0;6;"En la crono por equipos. Tunja pic.twitter.com/YrzijW9hI9";;;;"1227687415525072912";https://twitter.com/mnlzbl/status/1227687415525072912
;2020-02-12 22:05;0;0;"ユウ（異聞）： ユ ウ ＝ エ ス ト レ ア 反 逆 精 神 克 己 心 頑 張 れ 若 者 ！";;;;"1227685103532265472";https://twitter.com/Crono_SW_bot/status/1227685103532265472
;2020-02-12 21:52;0;0;"pic.twitter.com/9amP57smdm";;;;"1227682017707425799";https://twitter.com/yung_crono/status/1227682017707425799
;2020-02-12 21:49;0;2;"Naaaaah this ajyal 2021 grand finals when crono is actually a dlc and crono picks crono up";;;;"1227681080276389889";https://twitter.com/mynamesAMM/status/1227681080276389889
;2020-02-12 21:48;0;0;"Kurimanzutto y Campoadentro, el escaparate de la blanquitud desde la ruralidad.";;;;"1227680805570433031";https://twitter.com/Crono_grama/status/1227680805570433031
;2020-02-12 21:40;0;0;"# AlineBesouro hizo un dibujo de mi.pic.twitter.com/k4DV6uapHE";;;#;"1227678889004216320";https://twitter.com/Crono_grama/status/1227678889004216320
;2020-02-12 21:40;0;1;"pic.twitter.com/P6mixmmu16";;;;"1227678771953721346";https://twitter.com/Crono_Wolf/status/1227678771953721346
;2020-02-12 21:31;0;0;"今日の学び Tspindoubleは糞ほど簡単 課題 DT砲、SJLIspin、ドネイト、Tspintriple";;;;"1227676552462262273";https://twitter.com/Crono_kit/status/1227676552462262273
;2020-02-12 21:29;0;1;"Veramente caldo.";;;;"1227676054954881029";https://twitter.com/toninodeluc/status/1227676054954881029
;2020-02-12 21:21;0;0;"It’s a shame he couldn’t be playable in Smash due to using a funky staff instead of a sword. At least the Edrick alt based on him looks really good though.";;;;"1227674134567583745";https://twitter.com/yung_crono/status/1227674134567583745
;2020-02-12 21:20;0;0;"The host for The Game Awards.";;;;"1227673757822726144";https://twitter.com/yung_crono/status/1227673757822726144
;2020-02-12 21:06;0;2;"Era ese o puta";;;;"1227670365478014976";https://twitter.com/Crono_x2/status/1227670365478014976
;2020-02-12 21:03;0;1;"kskkdsj ya sabia q me ibas a decir eso.";;;;"1227669491917770756";https://twitter.com/berrettasofi/status/1227669491917770756
;2020-02-12 20:58;0;1;"Este señor corredor a tener en cuenta en el futuro, bueno escalando, bueno en crono. Dará de que hablar en las grandes @ ESPNBike @ mario_sabato @ victorhugopenag @ leidy0214 @ mundociclisticohttps://twitter.com/mundociclistico/status/1227620759058644992 …";;@ @ @ @ @;;"1227668438639878145";https://twitter.com/ehulamen/status/1227668438639878145
;2020-02-12 20:58;0;9;"Milipilis:";;;;"1227668370159554560";https://twitter.com/Crono___x/status/1227668370159554560
;2020-02-12 20:57;0;0;"Gueymallen triple blanco";;;;"1227668021071708160";https://twitter.com/Crono___x/status/1227668021071708160
;2020-02-12 20:54;0;5;"La";;;;"1227667219372531712";https://twitter.com/Crono_x2/status/1227667219372531712
;2020-02-12 20:53;0;1;"ah pero no sabes mi segundo nombre";;;;"1227667087319015427";https://twitter.com/berrettasofi/status/1227667087319015427
;2020-02-12 20:48;0;0;"I have my own suggestions: Crono, Robo, and Ayla. With a bonus Frog.";;;;"1227665920950063104";https://twitter.com/Dragonstars/status/1227665920950063104
;2020-02-12 20:48;0;0;"O problema é que o texto fala como se fossem 4 jogos de Roger... Dos últimos 21 ele só venceu 3... Já foi eliminado da CB Já perdeu um clássico e caiu na tabela da CN E hoje veremos o que acontece na Sul-americana. Mas temos que ter paciência, no final do ano, rebaixado, mudamos";;;;"1227665909919162368";https://twitter.com/Pressionando/status/1227665909919162368
;2020-02-12 20:38;0;2;"Del perrito es tu apellido, tampoco tan complicado viste";;;;"1227663257663610880";https://twitter.com/Crono_x2/status/1227663257663610880
;2020-02-12 20:37;0;0;"Soy tauro así que creo que pizzero de ranela";;;;"1227662963710070786";https://twitter.com/Crono_x2/status/1227662963710070786
;2020-02-12 20:35;0;0;"18z?";;;;"1227662553159020545";https://twitter.com/Crono_x2/status/1227662553159020545
;2020-02-12 20:34;0;0;"334";;;;"1227662156881154049";https://twitter.com/Crono_kit/status/1227662156881154049
;2020-02-12 20:33;0;0;"Okey";;;;"1227662086442016768";https://twitter.com/Crono_x2/status/1227662086442016768
;2020-02-12 20:33;0;1;"Noooo Alisson que hiciste";;;;"1227661965964840960";https://twitter.com/Crono_x2/status/1227661965964840960
;2020-02-12 20:31;0;0;"El bot del modo entrenamiento de cualquier juego de pelea:";;;;"1227661411045838849";https://twitter.com/Crono_x2/status/1227661411045838849
;2020-02-12 20:27;0;0;"@ mario_sabato Mario, felicidades por la transmisión de la 2da vuelta del tour Colombia! Tengo una pregunta para tí, ¿Que piensas ha pasado con el súper team Ineos? Ayer en la crono y hoy siento no han estado al tanto de las expectativas. Saludos desde Chile!";;@;;"1227660484440154115";https://twitter.com/Moragandres/status/1227660484440154115
;2020-02-12 20:26;0;0;"そんなに都合よくないですよね(笑) 金ロザと、どちらを着けるか迷う所です(笑)";;;;"1227660230114201600";https://twitter.com/zgmfx30aka/status/1227660230114201600
;2020-02-12 20:25;0;1;"Para ese culo es de mí prima";;;;"1227660026774466572";https://twitter.com/Crono_x2/status/1227660026774466572
;2020-02-12 20:24;0;0;"Alto vitíligo";;;;"1227659694107430912";https://twitter.com/Crono_x2/status/1227659694107430912
;2020-02-12 20:24;0;1;"ああ、なるほど。確かにダメージ軽減欲しかったですね(´Д｀)";;;;"1227659643150725120";https://twitter.com/Crono_1989/status/1227659643150725120
;2020-02-12 20:18;0;2;"A casa dembele";;;;"1227658181830217734";https://twitter.com/Crono_x2/status/1227658181830217734
;2020-02-12 20:15;0;2;"Paso femilagros y dijo que no sea tan mogolico";;;;"1227657471147245573";https://twitter.com/Crono_x2/status/1227657471147245573
;2020-02-12 20:14;0;1;"ありがとうございます 凄いんですね 自分でもビックです ダメージ軽減あると思った(汗)";;;;"1227657199175921664";https://twitter.com/zgmfx30aka/status/1227657199175921664
;2020-02-12 20:11;0;1;"Para Bro te pedí un helado de granizado nomás";;;;"1227656574027673608";https://twitter.com/Crono_x2/status/1227656574027673608
;2020-02-12 20:08;0;1;"Y digo yo... ¿No sería más fácil hacer esta carrera coincidir en día con el primer día de la Madrid Challenge en vez de meter una gili-crono para ellas?";;;;"1227655634662969344";https://twitter.com/FraileEriz/status/1227655634662969344
;2020-02-12 20:05;0;0;"シンシア 「……ふ」 変身をゆっくりと解き、ひょいっ、と屋根から降りた 「が……ッ！？」 ぐきぃ……ッ！ 「……～～～～っ、！！」 ぴょん、ぴょん、ぴょんっ……、 ユリウス「………………」 シンシア「くっ」 ユリウス「……見ていません」「俺は、何も見ていませんから……」";;;;"1227654904899985408";https://twitter.com/Crono_SW_bot/status/1227654904899985408
;2020-02-12 20:05;0;54;"Como se já não bastasse a tristeza pelo relato, ainda tenho que ler os idiotas perguntando "cadê o machismo?" é de fuder viu. Haja paciência.";;;;"1227654903667003392";https://twitter.com/crono_lol/status/1227654903667003392
;2020-02-12 20:01;1;2;"i like how in chrono trigger whenever you win a battle crono does a pogchamp face";;;;"1227654094543839239";https://twitter.com/ce_heich_ce/status/1227654094543839239
;2020-02-12 19:59;0;0;"Campionati Italiani Master Strada, Crono e Cicloturismo: le date del 2020 http://www.ruoteamatoriali.it/strada/26716-campionati-italiani-master-strada-crono-e-cicloturismo-le-date-del-2020.html …";;;;"1227653579168768002";https://twitter.com/RuoteAmatoriali/status/1227653579168768002
;2020-02-12 19:52;0;1;"ちょっとやばいっすよね";;;;"1227651782718812161";https://twitter.com/inuryu/status/1227651782718812161
;2020-02-12 19:51;0;1;"peter 18? straight single crono trigger pedophiles and mr game and watch you are from the Plymouth area did I pass";;;;"1227651339578232834";https://twitter.com/elllllllliotE/status/1227651339578232834
;2020-02-12 19:42;0;4;"Tienen la tradición de postearlos en la madrugada y borrarlos después de un tiempo. La razón aún queda pendiente";;;;"1227649203905556480";https://twitter.com/Leaf_Crono/status/1227649203905556480
;2020-02-12 19:40;0;0;"気持ち悪いですね・・・・(´・ω・｀)";;;;"1227648769325273088";https://twitter.com/Crono_1989/status/1227648769325273088
;2020-02-12 19:36;0;0;"おお、凄い。あとは最大HP3×3か守備力5×3ですね。HPを趣味で作るレベルでしょうか・・・？";;;;"1227647696984395776";https://twitter.com/Crono_1989/status/1227647696984395776
;2020-02-12 19:35;0;2;"@ Crono_mnhttps://twitter.com/RosemaryMosco/status/1227309229264048128 …";;@;;"1227647499483205633";https://twitter.com/jophsertanaka/status/1227647499483205633
;2020-02-12 19:31;0;5;"“I feel like I can even do combos now!” Owch, you didn’t have to do the homie Toon like that.";;;;"1227646536705826821";https://twitter.com/yung_crono/status/1227646536705826821
;2020-02-12 19:31;0;0;"ウィン「へー……悪魔とか魔神とか、面白い生態してんなぁ」 ──一定時間経過して。黒い球体は、ずるりと元のグリフォンの姿に戻り…… グリフォン「何しやがんだクソガキ！！！！」 突如、雷攻撃が発生する！！！ ウィン「ああああああああああ！？」";;;;"1227646357000708097";https://twitter.com/Crono_SW_bot/status/1227646357000708097
;2020-02-12 19:25;0;0;"線形終わったらWEEやるんだ...";;;;"1227644805909491714";https://twitter.com/Crono_kit/status/1227644805909491714
;2020-02-12 19:17;0;0;"3400-3420 $ # ES_F $ VX_f at14 = sell off with a V or U shaped recovery then another sell off. This will not be Crono-19 related.";;;#;"1227642998302707712";https://twitter.com/ARCASH/status/1227642998302707712
;2020-02-12 19:12;1;2;"Jonathan Caicedo: “Estoy muy feliz por el papel de la crono. El mérito es del equipo.” # LaRedenPedales";;;#;"1227641571560099842";https://twitter.com/LaRedEcuador/status/1227641571560099842
;2020-02-12 19:09;0;0;"章末やるなら計算方法覚えるために例題やってる方がまし 計算これどうあがいても手計算は出来ないか、徒労";;;;"1227640763934113792";https://twitter.com/Crono_kit/status/1227640763934113792
;2020-02-12 19:06;0;1;"今日も沢山描きました(˘ω˘) おやすみなさーい( [▓▓]_*˘꒳˘*)_ｽﾔｧ";;;;"1227640218791997440";https://twitter.com/crono_tiger/status/1227640218791997440
;2020-02-12 19:05;0;0;"白ウォズ 「祝え！ 巨悪を駆逐し、新たな未来へ我等を導くイル・サルバトーレ！ その名も仮面ライダーゲイツ 鎧武アーマー！ 真の救世主がこの地に降り立った瞬間である！ ──ハハハハ…！」";;;;"1227639804415791104";https://twitter.com/Crono_SW_bot/status/1227639804415791104
;2020-02-12 19:04;0;1;"これ章末やる意味ないかもしれん";;;;"1227639573842481155";https://twitter.com/Crono_kit/status/1227639573842481155
;2020-02-12 19:01;0;0;"お前単位なんか違うと思ったらやっぱりオングストロームか 潰れてたけど2乗だから分かってやったぞ感謝しろ若林";;;;"1227638810420314115";https://twitter.com/Crono_kit/status/1227638810420314115
;2020-02-12 19:00;2;4;"Ihr wollt mich in Smash verlieren sehen? Dann schaut ab 20 Uhr nach dem Namen Crono in dem stream :D https://www.twitch.tv/smashbrexit";;;;"1227638653620510720";https://twitter.com/FutureNo_/status/1227638653620510720
;2020-02-12 18:57;0;0;"学校で勉強してると大声出せて良いな";;;;"1227637948973232131";https://twitter.com/Crono_kit/status/1227637948973232131
;2020-02-12 18:56;0;0;"野田ありがとう";;;;"1227637535859499008";https://twitter.com/Crono_kit/status/1227637535859499008
;2020-02-12 18:55;0;1;"ドイツ語秀で暴れ回る人";;;;"1227637464250114049";https://twitter.com/Crono_kit/status/1227637464250114049
;2020-02-12 18:54;0;0;"I’m mad that you actually, unironically picked Goku Crono >";;;;"1227637021952356353";https://twitter.com/darthkamikaze/status/1227637021952356353
;2020-02-12 18:49;0;0;"Lemme fix that for ya Shantae Noctis (or another FF rep) Doom Guy (MC also acceptable) Crono Sub-Zero & Waddle Dee would be a perfect mirror to Plant";;;;"1227635975511166977";https://twitter.com/darthkamikaze/status/1227635975511166977
;2020-02-12 18:49;0;0;"Crono";;;;"1227635822662504448";https://twitter.com/KrlitoBrigante/status/1227635822662504448
;2020-02-12 18:49;0;0;"Crono";;;;"1227635800277475330";https://twitter.com/KrlitoBrigante/status/1227635800277475330
;2020-02-12 18:45;0;0;"Yea";;;;"1227634810463584257";https://twitter.com/jophsertanaka/status/1227634810463584257
;2020-02-12 18:45;0;0;"ほしい";;;;"1227634810249605120";https://twitter.com/Radon_137/status/1227634810249605120
;2020-02-12 18:44;0;0;"若林お前英数字潰れてるぞどんなフォントを使ったんだ";;;;"1227634631245213697";https://twitter.com/Crono_kit/status/1227634631245213697
;2020-02-12 18:41;0;1;"去年ならいる？ 一昨年のは自分で考えて";;;;"1227633960748015616";https://twitter.com/Crono_kit/status/1227633960748015616
;2020-02-12 18:33;0;0;"寝る準備するー";;;;"1227631935012265984";https://twitter.com/crono_tiger/status/1227631935012265984
;2020-02-12 18:32;0;0;"-1.282×8.314×ln0.702は流石に大学一年生が手計算で出せるものではない";;;;"1227631606795509760";https://twitter.com/Crono_kit/status/1227631606795509760
;2020-02-12 18:26;0;5;"そういや兄ちゃんちゃんと描いたことなかったなとpic.twitter.com/oZrPEWbrFi";;;;"1227630040818413568";https://twitter.com/crono_tiger/status/1227630040818413568
;2020-02-12 18:24;0;1;"エントロピーは自由度 熱量をお金と考えると お金を少ししか与えられてない子供は行ける場所がすくない（自由度が低い） お金をたくさん与えられた子供はいろいろな場所に行ける（自由度が高い）";;;;"1227629682083999748";https://twitter.com/Crono_kit/status/1227629682083999748
;2020-02-12 18:20;0;0;"地環の民は頑張って 章末普通に難しいし、ところどころ答え間違ってるから...";;;;"1227628499911008256";https://twitter.com/Crono_kit/status/1227628499911008256
;2020-02-12 18:19;0;1;"格好付けて教科書の文言で考えるな 齋藤は概念を理解してれば解ける問題を出すと言ってるんだから頭の中でモデルを立てて普段に置き換えて理解しろ";;;;"1227628290220924935";https://twitter.com/Crono_kit/status/1227628290220924935
;2020-02-12 18:18;0;1;"ラウールは系の中の粒子数が増えれば増えるほど圧が高くなることがポイントの一つ エレベーターに合計体重が同じだったとしてもお相撲さんが集まるより一般人が多く集まる方がぎゅうぎゅうになることと同じ";;;;"1227627939765903361";https://twitter.com/Crono_kit/status/1227627939765903361
;2020-02-12 18:16;0;1;"齋藤の化学を解く民へ 一般事象に置き換えて考えろ 例挙げるなら圧かけたらくっつくに決まってるし、動きが速くなったら捕まえづらいし、余計なところに割くより熱上げる方にしかエネルギー使わない方が温度は上がる";;;;"1227627527767764992";https://twitter.com/Crono_kit/status/1227627527767764992
;2020-02-12 18:14;0;0;"無理っす";;;;"1227626926006603778";https://twitter.com/Radon_137/status/1227626926006603778
;2020-02-12 18:13;0;1;"齋藤は余裕ゾ";;;;"1227626742485016576";https://twitter.com/Crono_kit/status/1227626742485016576
;2020-02-12 18:13;0;0;"向こうの垢で他の所のVの話するとRSAが飛んでくる恐れがあるからこちらで言うべきかもしれん難しい話だ";;;;"1227626680019230722";https://twitter.com/Crono_kit/status/1227626680019230722
;2020-02-12 18:11;0;0;"化学の章末の計算流石に手でやらされないよな... 齋藤はマークシートだし傾向的に大丈夫だよな... 文字式なら良いけど";;;;"1227626239743209478";https://twitter.com/Crono_kit/status/1227626239743209478
;2020-02-12 18:05;0;0;"ウィン「うるせえ！ バカって言ったほうがバカなんだよバーカ！ バカバカバカバカバーーーカ！ はいいま俺何回言ったでしょう！」 グリフォン「今バカって言ったから今はお前がバカー！」 ウィン「うるせ～～～～！ しらね～～～～～！！！！」 グリフォン「どぅあっつ！！！」";;;;"1227624707748323328";https://twitter.com/Crono_SW_bot/status/1227624707748323328
;2020-02-12 18:03;0;1;"過去問の答えを持ちうる私はもしかしてコミュ強なのか...？";;;;"1227624156029734912";https://twitter.com/Crono_kit/status/1227624156029734912
;2020-02-12 18:01;0;0;"心臓が痛くならないのか？";;;;"1227623880174514177";https://twitter.com/Crono_kit/status/1227623880174514177
;2020-02-12 18:01;0;0;"若様は正面描きにくいんだよネーーーーーーーーーーーー";;;;"1227623865217507328";https://twitter.com/crono_tiger/status/1227623865217507328
;2020-02-12 18:00;0;1;"Crono to 6K First";;;;"1227623639291506688";https://twitter.com/SiphiEditor/status/1227623639291506688
;2020-02-12 18:00;0;0;"| # TORRENT # NOUTORRENTÍ Torrent, protagonista del VII Circuit MTB València Més de 600 ciclistes realitzaran una marxa i una crono a Torrent els dies 15 i 16 de febrer @ Aj_Torrenthttp://ow.ly/gTZA50ykvqs";;@;# #;"1227623523545485312";https://twitter.com/NouHorta/status/1227623523545485312
;2020-02-12 18:00;0;0;"〇〇が俺の嫁ってもう廃れた文化なのか... 生きるのが辛いも廃れてるのか...";;;;"1227623491442282498";https://twitter.com/Crono_kit/status/1227623491442282498
